doi,title,year,final_decision,hard_filter_status,1_population_decision,1_population_quote,1_population_verified,2_concept_decision,2_concept_quote,2_concept_verified,3_context_decision,3_context_quote,3_context_verified,4_methodology_decision,4_methodology_quote,4_methodology_verified,5_geography_decision,5_geography_quote,5_geography_verified,final_decision.1,source_type,title_scopus,publicationName,coverDate,doi_scopus,in_scopus_retrieval,citation
10.1016/j.ijdrr.2018.01.032,The risk of second-best adaptive measures: Farmers facing drought in Thailand,2018.0,include,pass,yes,farmers to adapt to climate events,True,yes,adaptive measures taken by farmers,True,yes,hydrological drought in 2015 and 2016,True,yes,interviewed farmers were able to implement first-best adaptive measures,True,yes,"Suphanburi Province, Thailand",True,include,Peer Reviewed,,,,,False,(2018) The risk of second-best adaptive measures: Farmers facing drought in Thailand. [Journal unavailable – not indexed in Scopus]. https://doi.org/10.1016/j.ijdrr.2018.01.032
10.1186/s40066-017-0100-1,Smallholder farmers’ adaptation to climate change and determinants of their adaptation decisions in the Central Rift Valley of Ethiopia,2017.0,include,pass,yes,smallholder farmers,True,yes,adaptation strategies they practice,True,yes,"climate variability, and 85% made attempts to adapt using practices like crop diversification",True,yes,a multinomial logit model was employed,True,yes,Central Rift Valley of Ethiopia,True,include,Peer Reviewed,Smallholder farmers' adaptation to climate change and determinants of their adaptation decisions in the Central Rift Valley of Ethiopia,Agriculture and Food Security,2017-03-06,10.1186/s40066-017-0100-1,True,(2017) Smallholder farmers’ adaptation to climate change and determinants of their adaptation decisions in the Central Rift Valley of Ethiopia. Agriculture and Food Security. https://doi.org/10.1186/s40066-017-0100-1
10.1016/j.gloenvcha.2011.11.012,Can farmers’ adaptation to climate change be explained by socio-economic household-level variables?,2012.0,include,pass,yes,farmers’ adaptation to climate change,True,yes,farmers’ adaptation to climate change,True,yes,"system of relatively high agricultural potential, whereas the Gairo ward represents a system of low agricultural potential.",True,yes,"A household survey, a rapid rural appraisal and, a stakeholder workshop were used for data collection",True,yes,Morogoro region of Tanzania,True,include,Peer Reviewed,Can farmers' adaptation to climate change be explained by socio-economic household-level variables?,Global Environmental Change,2012-02-01,10.1016/j.gloenvcha.2011.11.012,True,(2012) Can farmers’ adaptation to climate change be explained by socio-economic household-level variables?. Global Environmental Change. https://doi.org/10.1016/j.gloenvcha.2011.11.012
10.1007/s10668-023-04301-x,"Nam, L. P., Van Song, N., Quilloy, A. J., Rañola, R. F., Camacho, J. V., Camacho, L. D., & Eluriagac, L. M. (2023, December). Assessment of impacts of adaptation measures on rice farm economic performance in response to climate change: Case study in Vietnam. Environment, Development and Sustainability, 26, 32479–32507. doi:10.1007/s10668-023-04301-x",2023.0,include,pass,yes,A total of 260 rice farmers from Nong Cong district were selected as the sample for the study.,True,yes,The primary objective of this study is to conduct an economic assessment of the effect of adaptation strategies on the agricultural performance of rice farmers.,True,yes,"Climate change impacts, including rising temperatures, erratic changes in the frequency and quantity of rainfall, and the prevalence of extreme weather phenomena, pose threats to rice cultivation.",True,yes,Collected data were analyzed using propensity scores matching (PSM) and the analysis of variance (ANOVA) technique,True,yes,A total of 260 rice farmers from Nong Cong district were selected as the sample for the study.,True,include,Peer Reviewed,,,,,False,"(2023) Nam, L. P., Van Song, N., Quilloy, A. J., Rañola, R. F., Camacho, J. V., Camacho, L. D., & Eluriagac, L. M. (2023, December). Assessment of impacts of adaptation measures on rice farm economic performance in response to climate change: Case study in Vietnam. Environment, Development and Sustainability, 26, 32479–32507. doi:10.1007/s10668-023-04301-x. [Journal unavailable – not indexed in Scopus]. https://doi.org/10.1007/s10668-023-04301-x"
10.1016/j.jenvman.2019.109456,"Understanding smallholder farmers’ adaptation behaviors through climate change beliefs, risk perception, trust, and psychological distance: Evidence from wheat growers in Iran",2019.0,include,pass,yes,350 farmers from Kermanshah district in western of Iran were selected as our sample,True,yes,Understanding adaptation to CC has become a major concern for farmers,True,yes,Climate change (CC) poses severe threats to the agriculture sector in developing countries,True,yes,"Structural equation modeling found a complex relationship between overall CC belief, risk perception, psychological distance, trust and risk salience, and farmers' adaptation behaviors",True,yes,350 farmers from Kermanshah district in western of Iran were selected as our sample,True,include,Peer Reviewed,"Understanding smallholder farmers’ adaptation behaviors through climate change beliefs, risk perception, trust, and psychological distance: Evidence from wheat growers in Iran",Journal of Environmental Management,2019-11-15,10.1016/j.jenvman.2019.109456,True,"(2019) Understanding smallholder farmers’ adaptation behaviors through climate change beliefs, risk perception, trust, and psychological distance: Evidence from wheat growers in Iran. Journal of Environmental Management. https://doi.org/10.1016/j.jenvman.2019.109456"
10.1016/j.landusepol.2018.08.018,"Farmers’ risk perception, vulnerability, and adaptation to climate change in rural Pakistan",2018.0,include,pass,yes,farm households,True,yes,adaptation measures,True,yes,climate variability and the adaptation measures utilized by farm households,True,yes,A dataset of 600 respondents was collected using structured questionnaire,True,yes,Khyber Pakhtunkhwa province of Pakistan,True,include,Peer Reviewed,"Farmers’ risk perception, vulnerability, and adaptation to climate change in rural Pakistan",Land Use Policy,2018-12-01,10.1016/j.landusepol.2018.08.018,True,"(2018) Farmers’ risk perception, vulnerability, and adaptation to climate change in rural Pakistan. Land Use Policy. https://doi.org/10.1016/j.landusepol.2018.08.018"
10.1186/s40066-017-0144-2,Determinants of smallholder farmers’ decision to adopt adaptation options to climate change and variability in the Muger Sub basin of the Upper Blue Nile basin of Ethiopia,2017.0,include,pass,yes,smallholder farmers’ decisions to adopt adaptation options,True,yes,adopt adaptation options to climate change and variability,True,yes,negative impact of climate change and variability in the study area,True,yes,"quantitative and qualitative data were collected using a semi-structured questionnaire, focused group discussions, and key informant interviews",True,yes,Muger River sub-basin of the Blue Nile basin of Ethiopia,True,include,Peer Reviewed,Determinants of smallholder farmers' decision to adopt adaptation options to climate change and variability in the Muger Sub basin of the Upper Blue Nile basin of Ethiopia,Agriculture and Food Security,2017-12-01,10.1186/s40066-017-0144-2,True,(2017) Determinants of smallholder farmers’ decision to adopt adaptation options to climate change and variability in the Muger Sub basin of the Upper Blue Nile basin of Ethiopia. Agriculture and Food Security. https://doi.org/10.1186/s40066-017-0144-2
10.1016/j.landusepol.2017.10.023,Determinants of farmers’ adaptation to climate change in agricultural production in the central region of Vietnam,2018.0,include,pass,yes,small-scale farmers,True,yes,adaptation to climate change,True,yes,extreme weather conditions due to climate change,True,yes,binary logit model and multivariate probit model,True,yes,Central Region of Viet Nam,True,include,Peer Reviewed,,,,,False,(2018) Determinants of farmers’ adaptation to climate change in agricultural production in the central region of Vietnam. [Journal unavailable – not indexed in Scopus]. https://doi.org/10.1016/j.landusepol.2017.10.023
10.1007/s10661-019-7651-5,"Ullah, W., Nafees, M., Khurshid, M., & Nihei, T. (2019). Assessing farmers' perspectives on climate change for effective farm-level adaptation measures in Khyber Pakhtunkhwa, Pakistan. Environmental monitoring and assessment, 191, 547.",2019.0,include,pass,yes,"extensive field surveys, involving 116 farm households",True,yes,adaptation towards it have been studied,True,yes,"fluctuating temperature, evidence of yearly long droughts, and a steady shift in rainfall patterns",True,yes,"extensive field surveys, involving 116 farm households",True,yes,Charsadda district (lowlands) of Khyber Pakhtunkhwa province of Pakistan,True,include,Peer Reviewed,,,,,True,"(2019) Ullah, W., Nafees, M., Khurshid, M., & Nihei, T. (2019). Assessing farmers' perspectives on climate change for effective farm-level adaptation measures in Khyber Pakhtunkhwa, Pakistan. Environmental monitoring and assessment, 191, 547. [Journal unavailable – not indexed in Scopus]. https://doi.org/10.1007/s10661-019-7651-5"
10.1007/s11069-020-04127-0,"Budhathoki, N. K., Paton, D., Lassa, J. A., Bhatta, G. D., & Zander, K. K. (2020). Heat, cold, and floods: exploring farmers' motivations to adapt to extreme weather events in the Terai region of Nepal. Natural hazards, 103, 3213–3237. doi:10.1007/s11069-020-04127-0",2020.0,include,pass,yes,Smallholder farmers in Nepal are vulnerable to climate change-related extreme weather events.,True,yes,"Adaptation in the agriculture sector is needed to mitigate social, economic, and ecological impacts from increasing levels of hazard activity.",True,yes,"floods, cold spells, and heat waves",True,yes,a household survey of 350 farmers in the Terai region of Nepal was carried out,True,yes,Terai region of Nepal,True,include,Peer Reviewed,,,,,True,"(2020) Budhathoki, N. K., Paton, D., Lassa, J. A., Bhatta, G. D., & Zander, K. K. (2020). Heat, cold, and floods: exploring farmers' motivations to adapt to extreme weather events in the Terai region of Nepal. Natural hazards, 103, 3213–3237. doi:10.1007/s11069-020-04127-0. [Journal unavailable – not indexed in Scopus]. https://doi.org/10.1007/s11069-020-04127-0"
10.1016/j.jenvman.2017.04.073,Factors influencing smallholder farmers' behavioural intention towards adaptation to climate change in transitional climatic zones: A case study of Hwedza District in Zimbabwe,2017.0,include,pass,yes,smallholder farmers,True,yes,adaptation to climate change,True,yes,experiencing a drought,True,yes,"structured questionnaire, focus group discussions and key informant interviews",True,yes,Hwedza District in Zimbabwe,True,include,Peer Reviewed,Factors influencing smallholder farmers' behavioural intention towards adaptation to climate change in transitional climatic zones: A case study of Hwedza District in Zimbabwe,Journal of Environmental Management,2017-08-01,10.1016/j.jenvman.2017.04.073,True,(2017) Factors influencing smallholder farmers' behavioural intention towards adaptation to climate change in transitional climatic zones: A case study of Hwedza District in Zimbabwe. Journal of Environmental Management. https://doi.org/10.1016/j.jenvman.2017.04.073
10.1016/j.envdev.2017.06.006,Determinants of smallholder farmers' choice of coping and adaptation strategies to climate change and variability in the central highlands of Ethiopia,2017.0,include,pass,yes,smallholder farmers’ choice,True,yes,choice of coping and adaptation strategies to climate change,True,yes,climate change and variability in the central highlands of Ethiopia,True,yes,Binary logistic regression modeling was used based on a survey of 200 farmers.,True,yes,central highlands of Ethiopia,True,include,Peer Reviewed,Determinants of smallholder farmers’ choice of coping and adaptation strategies to climate change and variability in the central highlands of Ethiopia,Environmental Development,2017-12-01,10.1016/j.envdev.2017.06.006,True,(2017) Determinants of smallholder farmers' choice of coping and adaptation strategies to climate change and variability in the central highlands of Ethiopia. Environmental Development. https://doi.org/10.1016/j.envdev.2017.06.006
10.1016/j.landusepol.2021.105295,Climate change risk perceptions and agricultural adaptation strategies in vulnerable riverine char islands of Bangladesh,2021.0,include,pass,yes,Farmers in the riverine char islands of Bangladesh,True,yes,Agricultural adaptations to climate change,True,yes,"droughts, river erosion, and floods are the major climatic risks",True,yes,"Survey data were collected from 98 households, and focus group discussions",True,yes,Rydas Bari char under the Gaibandha District of Bangladesh,True,include,Peer Reviewed,,,,,False,(2021) Climate change risk perceptions and agricultural adaptation strategies in vulnerable riverine char islands of Bangladesh. [Journal unavailable – not indexed in Scopus]. https://doi.org/10.1016/j.landusepol.2021.105295
10.1016/j.scitotenv.2015.11.125,"Climate change vulnerability, adaptation and risk perceptions at farm level in Punjab, Pakistan",2016.0,include,pass,yes,We interviewed a total of 450 farming households,True,yes,This article investigates the farm level risk perceptions and different aspects of vulnerability to climate change including sensitivity and adaptive capacity,True,yes,"The country has experienced many severe floods, droughts and storms over the last decades.",True,yes,We interviewed a total of 450 farming households through structured questionnaires,True,yes,in three districts of Punjab province of Pakistan.,True,include,Peer Reviewed,"Climate change vulnerability, adaptation and risk perceptions at farm level in Punjab, Pakistan",Science of the Total Environment,2016-03-15,10.1016/j.scitotenv.2015.11.125,True,"(2016) Climate change vulnerability, adaptation and risk perceptions at farm level in Punjab, Pakistan. Science of the Total Environment. https://doi.org/10.1016/j.scitotenv.2015.11.125"
10.1016/j.agrformet.2016.04.010.,Assessing the benefits of weather and seasonal forecasts to millet growers in Niger,2016.0,include,pass,yes,Niger millet growers,True,yes,assessing the impacts of 10-days and seasonal forecasts on Niger millet growers' cropping practices and their income,True,yes,"crucial decisions based on some characteristics of the rainy season such as the onset, the offset, the cumulated rainfall or the occurrence of dry spells",True,yes,we apply an ex-ante approach based on the crop model SARRA-H coupled with an economic model that simulates the choice of cropping strategies among 24 available,True,yes,Niger millet growers,True,include,Peer Reviewed,,,,,False,(2016) Assessing the benefits of weather and seasonal forecasts to millet growers in Niger. [Journal unavailable – not indexed in Scopus]. https://doi.org/10.1016/j.agrformet.2016.04.010.
10.1016/j.crm.2014.02.001.,The role of climate forecasts in smallholder agriculture: Lessons from participatory research in two communities in Senegal,2014.0,include,pass,yes,participatory research with farmers from two agro-ecological zones of Senegal,True,yes,improving resilience of African agriculture to climate shocks,True,yes,climate forecasts may be able to help Senegalese farmers adapt to climate variability,True,yes,This article presents results from participatory research with farmers,True,yes,"two agro-ecological zones of Senegal, West Africa",True,include,Peer Reviewed,The role of climate forecasts in smallholder agriculture: Lessons from participatory research in two communities in Senegal,Climate Risk Management,2014-01-01,10.1016/j.crm.2014.02.001,True,(2014) The role of climate forecasts in smallholder agriculture: Lessons from participatory research in two communities in Senegal. Climate Risk Management. https://doi.org/10.1016/j.crm.2014.02.001.
10.1016/j.crm.2019.100204,Understanding adaptive capacity of smallholder African indigenous vegetable farmers to climate change in Kenya,2020.0,include,pass,yes,African indigenous vegetable (AIV) farmers,True,yes,adaptive capacity (AC),True,yes,climate change (CC) is resulting in unpredictable alterations in weather patterns,True,yes,Quantitative data from 269 African indigenous vegetable (AIV) farmers,True,yes,three selected agro-climatic zones in Kenya,True,include,Peer Reviewed,Understanding adaptive capacity of smallholder African indigenous vegetable farmers to climate change in Kenya,Climate Risk Management,2020-01-01,10.1016/j.crm.2019.100204,True,(2020) Understanding adaptive capacity of smallholder African indigenous vegetable farmers to climate change in Kenya. Climate Risk Management. https://doi.org/10.1016/j.crm.2019.100204
10.1371/journal.pone.0219393,"Exploring households’ resilience to climate change-induced shocks using Climate Resilience Index in Dinki watershed, central highlands of Ethiopia",2019.0,include,pass,yes,households’ resilience to climate change-induced shocks,True,yes,Climate Resilience Index (CRI) based on the three resilience capacities,True,yes,households’ resilience to climate change-induced shocks,True,yes,principal component analysis (PCA) and multiple regression analysis,True,yes,"Dinki watershed, northcentral highlands of Ethiopia",True,include,Peer Reviewed,"Exploring households’ resilience to climate change-induced shocks using Climate Resilience Index in Dinki watershed, central highlands of Ethiopia",Plos One,2019-07-01,10.1371/journal.pone.0219393,True,"(2019) Exploring households’ resilience to climate change-induced shocks using Climate Resilience Index in Dinki watershed, central highlands of Ethiopia. Plos One. https://doi.org/10.1371/journal.pone.0219393"
10.1016/j.jenvman.2012.10.036,Adapting agriculture to climate change in Kenya: Household strategies and determinants,2013.0,include,pass,yes,Based on farm household and Participatory Rural Appraisal data collected from districts in various agroecological zones in Kenya,True,yes,"this paper examines farmers' perceptions of climate change, ongoing adaptation measures, and factors influencing farmers' decisions to adapt.",True,yes,"Countries in Sub-Saharan Africa are particularly vulnerable to climate change, given dependence on agricultural production",True,yes,Based on farm household and Participatory Rural Appraisal data collected from districts in various agroecological zones in Kenya,True,yes,data collected from districts in various agroecological zones in Kenya,True,include,Peer Reviewed,Adapting agriculture to climate change in Kenya: Household strategies and determinants,Journal of Environmental Management,2013-01-05,10.1016/j.jenvman.2012.10.036,True,(2013) Adapting agriculture to climate change in Kenya: Household strategies and determinants. Journal of Environmental Management. https://doi.org/10.1016/j.jenvman.2012.10.036
10.5539/sar.v2n3p107,"Knowledge, Perception and Adaptation Strategies to Climate Change Among Farmers of Central State Nigeria",2013.0,include,pass,yes,Farmers of central Nigeria,True,yes,adaptation strategies to climate change among farmers,True,yes,"excessive high temperatures, low and irregular rainfall pattern as well as low crop yields",True,yes,Multi-Stage sampling technique was used to source respondents for the study.,True,yes,Farmers of central Nigeria,True,include,Peer Reviewed,,,,,False,"(2013) Knowledge, Perception and Adaptation Strategies to Climate Change Among Farmers of Central State Nigeria. [Journal unavailable – not indexed in Scopus]. https://doi.org/10.5539/sar.v2n3p107"
10.1108/ijccsm-01-2019-0004,Three-stage quantitative approach of understanding household adaptation decisions in rural Cambodia,2020.0,include,pass,yes,households’ adaptation decisions,True,yes,determinants of household decisions to adapt,True,yes,households’ decisions in both adaptation status and intensity.,True,yes,double hurdle model and multivariate probit model,True,yes,rural Cambodia,True,include,Peer Reviewed,,,,,False,(2020) Three-stage quantitative approach of understanding household adaptation decisions in rural Cambodia. [Journal unavailable – not indexed in Scopus]. https://doi.org/10.1108/ijccsm-01-2019-0004
10.1016/j.envsci.2019.08.006,Derivation of a climate change adaptation index and assessing determinants and barriers to adaptation among farming households in Nepal,2019.0,include,pass,yes,smallholder farmers,True,yes,derivation of an adaptation index,True,yes,climate change adaptation practices,True,yes,questionnaire survey of 720 farming households,True,yes,Nepal,True,include,Peer Reviewed,Derivation of a climate change adaptation index and assessing determinants and barriers to adaptation among farming households in Nepal,Environmental Science and Policy,2019-11-01,10.1016/j.envsci.2019.08.006,True,(2019) Derivation of a climate change adaptation index and assessing determinants and barriers to adaptation among farming households in Nepal. Environmental Science and Policy. https://doi.org/10.1016/j.envsci.2019.08.006
10.9734/ajaees/2024/v42i112612,Climate Change Adaptation Mechanisms for Smallholder Farmers in Côte d’Ivoire,2024.0,include,pass,yes,smallholder farmers,True,yes,adaptation mechanisms,True,yes,climate change,True,yes,World Bank’s CGAP survey (2016),True,yes,Côte d'Ivoire,True,include,Peer Reviewed,,,,,False,(2024) Climate Change Adaptation Mechanisms for Smallholder Farmers in Côte d’Ivoire. [Journal unavailable – not indexed in Scopus]. https://doi.org/10.9734/ajaees/2024/v42i112612
10.1016/j.ecolecon.2017.08.006,"Farmers' Adaptation to Climate Change, Its Determinants and Impacts on Rice Yield in Nepal",2018.0,include,pass,yes,survey of 422 rice farmers in Nepal,True,yes,farmers' decision-making in adopting climate change adaptation strategies,True,yes,experience with climate change impacts such as drought and flood,True,yes,Based on a survey of 422 rice farmers in Nepal,True,yes,survey of 422 rice farmers in Nepal,True,include,Peer Reviewed,,,,,False,"(2018) Farmers' Adaptation to Climate Change, Its Determinants and Impacts on Rice Yield in Nepal. [Journal unavailable – not indexed in Scopus]. https://doi.org/10.1016/j.ecolecon.2017.08.006"
10.1016/j.envsci.2014.04.002,"Understanding farmers’ adaptation intention to climate change: A structural equation modelling study in the Mekong Delta, Vietnam",2014.0,include,pass,yes,"Data was obtained from structured interviews with 598 rice farmers in the Mekong Delta, Vietnam",True,yes,investigate the adaptation intention of farmers,True,yes,in response to climate change,True,yes,Structural equation modelling was used for investigating the relationships between constructs.,True,yes,"Mekong Delta, Vietnam",True,include,Peer Reviewed,,,,,False,"(2014) Understanding farmers’ adaptation intention to climate change: A structural equation modelling study in the Mekong Delta, Vietnam. [Journal unavailable – not indexed in Scopus]. https://doi.org/10.1016/j.envsci.2014.04.002"
10.3390/sci2040087,Perception to Adaptation of Climate Change in Nepal: An Empirical Analysis Using Multivariate Probit Model,2020.0,include,pass,yes,A survey in 300 agricultural households was carried out,True,yes,"estimated the determinants of, and evaluated the relationship among, adaptation practices using the multivariate probit model.",True,yes,This study assessed farmers’ perception of climate change,True,yes,"estimated the determinants of, and evaluated the relationship among, adaptation practices using the multivariate probit model.",True,yes,A survey in 300 agricultural households was carried out covering 10 sample districts considering five agro-ecological zones,True,include,Peer Reviewed,Perception to Adaptation of Climate Change in Nepal: An Empirical Analysis Using Multivariate Probit Model,Sci,2020-12-01,10.3390/sci2040087,True,(2020) Perception to Adaptation of Climate Change in Nepal: An Empirical Analysis Using Multivariate Probit Model. Sci. https://doi.org/10.3390/sci2040087
10.1016/j.landusepol.2020.104553,Understanding farmers’ climate adaptation intention in Iran: A protection-motivation extended model,2020.0,include,pass,yes,farmers’ decision-making,True,yes,Adaptation to climate change is a matter of urgent social scientific analysis.,True,yes,Marvdasht County in Iran – a case that exemplifies agricultural stakeholder decision-making in arid and drought-prone regions,True,yes,employing a correlational survey among 256 farmer-stakeholders.,True,yes,Marvdasht County in Iran,True,include,Peer Reviewed,,,,,False,(2020) Understanding farmers’ climate adaptation intention in Iran: A protection-motivation extended model. [Journal unavailable – not indexed in Scopus]. https://doi.org/10.1016/j.landusepol.2020.104553
