doi,title,year,final_decision,hard_filter_status,1_population_decision,1_population_quote,1_population_verified,2_concept_decision,2_concept_quote,2_concept_verified,3_context_decision,3_context_quote,3_context_verified,4_methodology_decision,4_methodology_quote,4_methodology_verified,5_geography_decision,5_geography_quote,5_geography_verified,final_decision.1,source_type,title_scopus,publicationName,coverDate,doi_scopus,in_scopus_retrieval,citation
10.1371/journal.pone.0196392,Diversification and intensification of agricultural adaptation from global to local scales,2018.0,include,pass,yes,Smallholder farming systems are vulnerable to a number of challenges,True,yes,"We examine two dimensions wherein smallholder farmers may adapt agricultural practices; through intensification (i.e., adopt more practices) or diversification (i.e. adopt different practices)",True,yes,compounded by uncertainty of climatic patterns,True,yes,We use data on 5314 randomly sampled households located in 38 sites in 15 countries across four regions,True,yes,"East and West Africa, South Asia, and Central America",True,include,Peer Reviewed,Diversification and intensification of agricultural adaptation from global to local scales,Plos One,2018-05-01,10.1371/journal.pone.0196392,True,(2018) Diversification and intensification of agricultural adaptation from global to local scales. Plos One. https://doi.org/10.1371/journal.pone.0196392
10.1007/s00267-014-0415-7,"Gebrehiwot, T., & van der Veen, A. (2014). Farmers prone to drought risk: Why some farmers undertake farm-level risk-reduction measures while others not? Environmental management, 55, 588–602.",2014.0,include,pass,yes,a representative sample survey of smallholder farmers in northern Ethiopia,True,yes,farm-level risk-reduction measures,True,yes,drought risk in the developing countries cultural context,True,yes,a representative sample survey of smallholder farmers in northern Ethiopia,True,yes,northern Ethiopia,True,include,Peer Reviewed,,,,,True,"(2014) Gebrehiwot, T., & van der Veen, A. (2014). Farmers prone to drought risk: Why some farmers undertake farm-level risk-reduction measures while others not? Environmental management, 55, 588–602. [Journal unavailable – not indexed in Scopus]. https://doi.org/10.1007/s00267-014-0415-7"
10.1007/s00267-013-0039-3,"Gebrehiwot, T., & van der Veen, A. (2013). Farm level adaptation to climate change: The case of farmer's in the Ethiopian highlands. Environmental management, 52, 29–44.",2013.0,include,pass,yes,survey of 400 smallholder farmers,True,yes,farmers’ choice of adaptation measures to climate change and variability,True,yes,climate change and associated risks are expected to have serious consequences for agriculture and food security,True,yes,"Multinomial logit model, employing the results from a survey of 400 smallholder farmers",True,yes,"survey of 400 smallholder farmers in three districts in Tigray, northern Ethiopian.",True,include,Peer Reviewed,,,,,True,"(2013) Gebrehiwot, T., & van der Veen, A. (2013). Farm level adaptation to climate change: The case of farmer's in the Ethiopian highlands. Environmental management, 52, 29–44. [Journal unavailable – not indexed in Scopus]. https://doi.org/10.1007/s00267-013-0039-3"
10.1080/14693062.2017.1389688,Smallholder farmers’ participation in climate change adaptation programmes: understanding preferences in Nepal,2017.0,include,pass,yes,Nepalese farmers,True,yes,willingness to support the implementation of adaptation programmes,True,yes,"climate adaptive crop species and varieties, improved soil quality and irrigation and the provision of training in climate adaptive farming.",True,yes,We then employed a choice experiment framework,True,yes,Nepalese farmers,True,include,Peer Reviewed,Smallholder farmers’ participation in climate change adaptation programmes: understanding preferences in Nepal,Climate Policy,2018-08-09,10.1080/14693062.2017.1389688,True,(2017) Smallholder farmers’ participation in climate change adaptation programmes: understanding preferences in Nepal. Climate Policy. https://doi.org/10.1080/14693062.2017.1389688
10.1016/j.gloenvcha.2009.01.002,Determinants of farmers’ choice of adaptation methods to climate change in the Nile Basin of Ethiopia,2009.0,include,pass,yes,farmers to adapt to climate change,True,yes,methods used by farmers to adapt to climate change,True,yes,adapt to climate change,True,yes,Results from the discrete choice model employed,True,yes,Nile Basin of Ethiopia,True,include,Peer Reviewed,,,,,False,(2009) Determinants of farmers’ choice of adaptation methods to climate change in the Nile Basin of Ethiopia. [Journal unavailable – not indexed in Scopus]. https://doi.org/10.1016/j.gloenvcha.2009.01.002
