doi,doi_clean,record_key,citation_raw,title_best,title_benchmark,title_fetched,type,identified_via,abstract,landing_url,fetch_status,source,status_code,error,fetched_utc,last_attempt_utc,fail_count,year,year_source,final_decision,notes,hard_filter_status,run_signature,timestamp_utc,1_population_decision,1_population_quote,1_population_verified,2_concept_decision,2_concept_quote,2_concept_verified,3_context_decision,3_context_quote,3_context_verified,4_methodology_decision,4_methodology_quote,4_methodology_verified,5_geography_decision,5_geography_quote,5_geography_verified,title,match_title,match_doi,simple_status,restored_type,source_type,title_scopus,publicationName,year_scopus,doi_scopus,citation_raw_scopus,author_names,in_scopus_retrieval,eligible_baseline,fetched_authors,fetched_journal,fetched_year,citation
10.1016/j.landusepol.2017.10.023,10.1016/j.landusepol.2017.10.023,10.1016/j.landusepol.2017.10.023,"Trinh, T., Ranola, R., Camacho, L., & Simelton, E. (2018). Determinants of farmers' adaptation to climate change in agricultural production in the central region of Vietnam. Land use policy, 70, 224–231.",,"Determinants of farmers' adaptation to climate change in agricultural production in the central region of Vietnam. Land use policy, 70, 224–231.",Determinants of farmers’ adaptation to climate change in agricultural production in the central region of Vietnam,Peer,Stakeholder - Pankaj Koirala,"This paper discusses the likely changes in farm cultural practices that farmers would adopt to minimize agricultural production losses as a response to the increasing occurrence of extreme weather conditions due to climate change in the Central Region of Viet Nam. Using binary logit model and multivariate probit model, this paper examined different factors influencing farmers decision on adaptation to climate change in their agricultural production. Training attendance, farm size, damage level, educational level, farming experience, access to credit, and gender were the factors that influenced significantly the probability that farmers would adapt to climate change. Of these factors, attendance in climate change training and farm size were the most important factors affecting the farmers decision on adaptation to climate change, while labor availability and membership in local organizations were not. Three policy recommendations were proposed to enhance small-scale farmers adaptive capacity to climate change in the region. These include: i). broadening of training courses on climate change; ii). institute policies that would promote consolidation of farmlands; and, iii). integrate concepts of climate change and climate change adaptation into the operation of the local organizations.",,ok,elsevier_api,200,,2026-01-22T20:06:23Z,2026-01-22T20:06:23Z,0,2018,parsed_from_citation,include,,pass,,,yes,small-scale farmers,True,yes,adaptation to climate change,True,yes,extreme weather conditions due to climate change,True,yes,binary logit model and multivariate probit model,True,yes,Central Region of Viet Nam,True,,,101016jlandusepol201710023,Passed,Unknown,Peer Reviewed,,,,,,,True,True,"Trinh, T., Rañola, R., Camacho, L. et al.",Land Use Policy,2018,"Trinh, T., Ranola, R., Camacho, L., & Simelton, E. (2018). Determinants of farmers' adaptation to climate change in agricultural production in the central region of Vietnam. Land use policy, 70, 224–231."
10.1007/s10661-019-7651-5,10.1007/s10661-019-7651-5,10.1007/s10661-019-7651-5,"Ullah, W., Nafees, M., Khurshid, M., & Nihei, T. (2019). Assessing farmers' perspectives on climate change for effective farm-level adaptation measures in Khyber Pakhtunkhwa, Pakistan. Environmental monitoring and assessment, 191, 547.",,"Assessing farmers' perspectives on climate change for effective farm-level adaptation measures in Khyber Pakhtunkhwa, Pakistan. Environmental monitoring and assessment, 191, 547.",,Peer,Stakeholder - Pankaj Koirala,"Agriculture is considered as the backbone of the economy of Pakistan. However, current changes in climate have been adversely affecting agricultural productivity. In this paper, perceived impacts of climate change on agriculture and adaptation towards it have been studied in Charsadda district (lowlands) of Khyber Pakhtunkhwa province of Pakistan through extensive field surveys, involving 116 farm households. Results have revealed that climate change factors including fluctuating temperature, evidence of yearly long droughts, and a steady shift in rainfall patterns have pressured the agriculture sector and livelihoods of the local peasants. The staggering floods of 2010 and 2011 in Pakistan have evidenced severe climatic changes in Pakistan. These countrywide floods have washed fertile soil in the study area that has directly contributed to losses in agricultural yield and increased vector-borne diseases in crops. The local farmers have commonly deployed adaptive measure such as crops diversification, changing fertilizer, and planting shaded trees to minimize the impacts of changes in climate. However, these adjustments measures are perceived as not appropriate for improving farm yield. Therefore, the study suggests that improved understanding of the climate change impacts and knowledge on adapting adequately will lead to no-regret adaptation. It will also help protecting farmer’s lives and livelihoods and will boost their resilience towards changing climatic conditions.",https://doi.org/10.1007/s10661-019-7651-5,ok,landing_meta,200,,2026-01-22T20:06:27Z,2026-01-22T20:06:27Z,0,2019,parsed_from_citation,include,,pass,,,yes,"extensive field surveys, involving 116 farm households",True,yes,adaptation towards it have been studied,True,yes,"fluctuating temperature, evidence of yearly long droughts, and a steady shift in rainfall patterns",True,yes,"extensive field surveys, involving 116 farm households",True,yes,Charsadda district (lowlands) of Khyber Pakhtunkhwa province of Pakistan,True,,,101007s1066101976515,Passed,Unknown,Peer Reviewed,,,,,,,True,True,"Ullah, W., Nafees, M., Khurshid, M. et al.",Environmental Monitoring and Assessment,2019,"Ullah, W., Nafees, M., Khurshid, M., & Nihei, T. (2019). Assessing farmers' perspectives on climate change for effective farm-level adaptation measures in Khyber Pakhtunkhwa, Pakistan. Environmental monitoring and assessment, 191, 547."
10.1007/s11069-020-04127-0,10.1007/s11069-020-04127-0,10.1007/s11069-020-04127-0,"Budhathoki, N. K., Paton, D., Lassa, J. A., Bhatta, G. D., & Zander, K. K. (2020). Heat, cold, and floods: exploring farmers' motivations to adapt to extreme weather events in the Terai region of Nepal. Natural hazards, 103, 3213–3237. doi:10.1007/s11069-020-04127-0",,"Heat, cold, and floods: exploring farmers' motivations to adapt to extreme weather events in the Terai region of Nepal. Natural hazards, 103, 3213–3237. doi:10.1007/s11069-020-04127-0",,Peer,Stakeholder - Pankaj Koirala,"Smallholder farmers in Nepal are vulnerable to climate change-related extreme weather events. Adaptation in the agriculture sector is needed to mitigate social, economic, and ecological impacts from increasing levels of hazard activity. To examine this issue, a household survey of 350 farmers in the Terai region of Nepal was carried out to assess farmers’ risk perceptions towards three common extreme weather events (floods, cold spells, and heat waves) and to explore their intended responses to cope with future impacts. The intended common adaptation strategies include changes in farm management, seeking off-farm employment, emergency management planning, purchasing crop insurance, and the raising of awareness. Threat appraisal is the strongest predictor of the number of intended adaptation strategies adopted in response to slow-onset hazards (heat waves and cold spells), while coping appraisal is the major predictor of the number of intended adaptation strategies adopted to mitigate flood risk, a rapid onset hazard. Crop insurance and off-farm employment are farmers’ most preferred flood adaptation strategies, while crop insurance is the most preferred adaptation strategy for heat waves and cold spells. Other variables such as the number of past implemented strategies, experience with extreme events, community organisation membership, and access to credit and extension services were also significantly associated with farmers’ choices for adaptation strategies in response to the three extreme events. This information can be used to tailor community-centred communication about potential threats from different extreme weather events and government technical and financial support, which will be crucial for farmers to adapt effectively to climate change-related weather extremes.",https://doi.org/10.1007/s11069-020-04127-0,ok,landing_meta,200,,2026-01-22T20:04:54Z,2026-01-22T20:04:54Z,0,2020,parsed_from_citation,include,,pass,,,yes,Smallholder farmers in Nepal are vulnerable to climate change-related extreme weather events.,True,yes,"Adaptation in the agriculture sector is needed to mitigate social, economic, and ecological impacts from increasing levels of hazard activity.",True,yes,"floods, cold spells, and heat waves",True,yes,a household survey of 350 farmers in the Terai region of Nepal was carried out,True,yes,Terai region of Nepal,True,,,101007s11069020041270,Passed,Unknown,Peer Reviewed,,,,,,,True,True,"Budhathoki, N., Paton, D., Lassa, J. et al.",Natural Hazards,2020,"Budhathoki, N. K., Paton, D., Lassa, J. A., Bhatta, G. D., & Zander, K. K. (2020). Heat, cold, and floods: exploring farmers' motivations to adapt to extreme weather events in the Terai region of Nepal. Natural hazards, 103, 3213–3237. doi:10.1007/s11069-020-04127-0"
10.1016/j.jenvman.2017.04.073,10.1016/j.jenvman.2017.04.073,10.1016/j.jenvman.2017.04.073,"Zamasiya, B., Nyikahadzoi, K., & Mukamuri, B. (2017). Factors influencing smallholder farmers' behavioural intention towards adaptation to climate change in transitional climatic zones: A case study of Hwedza District in Zimbabwe. Journal of environmental management, 198, 233–239. doi:10.1016/j.jenvman.2017.04.073",,"Factors influencing smallholder farmers' behavioural intention towards adaptation to climate change in transitional climatic zones: A case study of Hwedza District in Zimbabwe. Journal of environmental management, 198, 233–239. doi:10.1016/j.jenvman.2017.04.073",Factors influencing smallholder farmers' behavioural intention towards adaptation to climate change in transitional climatic zones: A case study of Hwedza District in Zimbabwe,Peer,Stakeholder - Pankaj Koirala,"This paper examines factors influencing behavioural change among smallholder farmers towards adaptation to climate change in transitional climatic zones of Africa, specifically, Hwedza District in Zimbabwe. Data for this study were collected from 400 randomly-selected smallholder farmers, using a structured questionnaire, focus group discussions and key informant interviews. The study used an ordered logit model to examine the factors that influence smallholder farmers' behavioural intention towards adaptation to climate change. Results from the study show that the gender of the household head, access to extension services on crop and livestock production, access to climate information, membership to social groups and experiencing a drought have a positive influence on farmers' attitude towards adaptation to climate change and variability. The study concluded that although the majority of smallholder farmers perceive that the climate is changing, they continue to habour negative attitudes towards prescribed climate change adaptation techniques. This study recommends more education on climate change, as well as adaptation strategies for both agricultural extension workers and farmers. This can be complemented by disseminating timely climate information through extension officers and farmers’ groups.",,ok,elsevier_api,200,,2026-01-22T20:06:36Z,2026-01-22T20:06:36Z,0,2017,parsed_from_citation,include,,pass,,,yes,smallholder farmers,True,yes,adaptation to climate change,True,yes,experiencing a drought,True,yes,"structured questionnaire, focus group discussions and key informant interviews",True,yes,Hwedza District in Zimbabwe,True,,,101016jjenvman201704073,Passed,Unknown,Peer Reviewed,,,,,,,True,True,"Zamasiya, B., Nyikahadzoi, K., Mukamuri, B.",Journal of Environmental Management,2017,"Zamasiya, B., Nyikahadzoi, K., & Mukamuri, B. (2017). Factors influencing smallholder farmers' behavioural intention towards adaptation to climate change in transitional climatic zones: A case study of Hwedza District in Zimbabwe. Journal of environmental management, 198, 233–239. doi:10.1016/j.jenvman.2017.04.073"
10.1016/j.envdev.2017.06.006,10.1016/j.envdev.2017.06.006,10.1016/j.envdev.2017.06.006,"Alemayehu, A., & Bewket, W. (2017). Determinants of smallholder farmers' choice of coping and adaptation strategies to climate change and variability in the central highlands of Ethiopia. Environmental development, 24, 77–85.",,"Determinants of smallholder farmers' choice of coping and adaptation strategies to climate change and variability in the central highlands of Ethiopia. Environmental development, 24, 77–85.",Determinants of smallholder farmers' choice of coping and adaptation strategies to climate change and variability in the central highlands of Ethiopia,Peer,Stakeholder - Pankaj Koirala,"This study presents analysis of determinants of smallholder farmers’ choice of coping and adaptation strategies to climate change and variability in the central highlands of Ethiopia. A distinction was made between coping and adaptation, as short-term responses to shocks and long-term responses to stressors, respectively. Binary logistic regression modeling was used based on a survey of 200 farmers. Socio-demographic, economic, biophysical, and institutional and infrastructural characteristics of the study setting and sample households were considered to identify key determinants of farmers’ choice of coping and adaptation strategies. This is premised on the fact that understanding significant determinants of farmers’ choice of coping and adaptation strategies is useful to design impactful adaptation interventions in the locality. The results showed that the significant factors affecting choice of adaptation strategies include perceived soil fertility status, perception of land tenure security, access to extension service, and ages of household heads. For the choice of coping options, agroecological zone, access to markets, farmer-to-farmer extension, landholding size, access to information on climate change, rainfall amount, and educational level of household heads were the significant determinants. Agroecological zone had negative influence to use selling livestock as coping strategy while the other variables had positive influences on farmers’ choice of coping and adaptation strategies. Off-farm income, community participation, ownership of livestock and temperature on the other hand had no significant influence on the choice of coping and adaptation strategies to climate change. Adaptation planning for the study locality should take into account the potential influence of these determinant factors into account.",,ok,elsevier_api,200,,2026-01-22T20:04:37Z,2026-01-22T20:04:37Z,0,2017,parsed_from_citation,include,,pass,,,yes,smallholder farmers’ choice,True,yes,choice of coping and adaptation strategies to climate change,True,yes,climate change and variability in the central highlands of Ethiopia,True,yes,Binary logistic regression modeling was used based on a survey of 200 farmers.,True,yes,central highlands of Ethiopia,True,,,101016jenvdev201706006,Passed,Unknown,Peer Reviewed,,,,,,,True,True,"Alemayehu, A., Bewket, W.",Environmental Development,2017,"Alemayehu, A., & Bewket, W. (2017). Determinants of smallholder farmers' choice of coping and adaptation strategies to climate change and variability in the central highlands of Ethiopia. Environmental development, 24, 77–85."
10.1016/j.landusepol.2021.105295,10.1016/j.landusepol.2021.105295,10.1016/j.landusepol.2021.105295,"Ahmed, Z., Guha, G., Shew, A., & Alam, G. (2021). Climate change risk perceptions and agricultural adaptation strategies in vulnerable riverine char islands of Bangladesh. Land use policy, 103, 105295.",,"Climate change risk perceptions and agricultural adaptation strategies in vulnerable riverine char islands of Bangladesh. Land use policy, 103, 105295.",Climate change risk perceptions and agricultural adaptation strategies in vulnerable riverine char islands of Bangladesh,Peer,Stakeholder - Pankaj Koirala,"Farmers in the riverine char islands of Bangladesh are frequently affected by climate change due to their proximity to the river and heavy reliance on agriculture for their livelihoods. The present study evaluates char dwellers’ risk perceptions and agricultural adaptations to climate change. Survey data were collected from 98 households, and focus group discussions were conducted using a semi-structured questionnaire from Rydas Bari char under the Gaibandha District of Bangladesh. A standardized risk perception index was created using a four-point Likert scale against sixteen climatic events. In addition, a binary logit model was used to estimate the influence of socioeconomic characteristics of sample households on the decision to choose climate change adaptation strategies. Findings suggest that droughts, river erosion, and floods are the major climatic risks perceived by char dwellers. Additionally, results from a climate vulnerability index portray similar findings that char respondents are more exposed to diverse climatic hazards. The study further investigates local adaptation mechanisms in agriculture with regards to major climatic events. In response to the existing climate change risks, the char inhabitants employ several adaptation strategies in agriculture such as implementing new or alternative farming practices, changing planting times, and cultivating short-duration varieties. The llogit analysis suggests that household age, family size, annual income, farm size, farm ownership and farming experience have a significant influence on farmers' adaptation choices. Household access to education, early warning by extension agents, information on improved agricultural technologies, access to off-farm sources of income and incorporating char people during policy design can effectively enhance farmers’ resilience and help reduce vulnerability.",,ok,elsevier_api,200,,2026-01-22T20:04:35Z,2026-01-22T20:04:35Z,0,2021,parsed_from_citation,include,,pass,,,yes,Farmers in the riverine char islands of Bangladesh,True,yes,Agricultural adaptations to climate change,True,yes,"droughts, river erosion, and floods are the major climatic risks",True,yes,"Survey data were collected from 98 households, and focus group discussions",True,yes,Rydas Bari char under the Gaibandha District of Bangladesh,True,,,101016jlandusepol2021105295,Passed,Unknown,Peer Reviewed,,,,,,,True,True,"Ahmed, Z., Guha, G., Shew, A. et al.",Land Use Policy,2021,"Ahmed, Z., Guha, G., Shew, A., & Alam, G. (2021). Climate change risk perceptions and agricultural adaptation strategies in vulnerable riverine char islands of Bangladesh. Land use policy, 103, 105295."
10.1016/j.scitotenv.2015.11.125,10.1016/j.scitotenv.2015.11.125,10.1016/j.scitotenv.2015.11.125,"Abid, M., Schilling, J., Scheffran, J., & Zulfiqar, F. (2016). Climate change vulnerability, adaptation and risk perceptions at farm level in Punjab, Pakistan. Science of the total environment, 547, 447–460.",,"Climate change vulnerability, adaptation and risk perceptions at farm level in Punjab, Pakistan. Science of the total environment, 547, 447–460.","Climate change vulnerability, adaptation and risk perceptions at farm level in Punjab, Pakistan",Peer,Stakeholder - Pankaj Koirala,"Pakistan is among the countries highly exposed and vulnerable to climate change. The country has experienced many severe floods, droughts and storms over the last decades. However, little research has focused on the investigation of vulnerability and adaptation to climate-related risks in Pakistan. Against this backdrop, this article investigates the farm level risk perceptions and different aspects of vulnerability to climate change including sensitivity and adaptive capacity at farm level in Pakistan. We interviewed a total of 450 farming households through structured questionnaires in three districts of Punjab province of Pakistan. This study identified a number of climate-related risks perceived by farm households such as extreme temperature events, insect attacks, animal diseases and crop pests. Limited water availability, high levels of poverty and a weak role of local government in providing proper infrastructure were the factors that make farmers more sensitive to climate-related risks. Uncertainty or reduction in crop and livestock yields; changed cropping calendars and water shortage were the major adverse impacts of climate-related risks reported by farmers in the study districts. Better crop production was reported as the only positive effect. Further, this study identified a number of farm level adaptation methods employed by farm households that include changes in crop variety, crop types, planting dates and input mix, depending upon the nature of the climate-related risks. Lack of resources, limited information, lack of finances and institutional support were some constraints that limit the adaptive capacity of farm households. This study also reveals a positive role of cooperation and negative role of conflict in the adaptation process. The study suggests to address the constraints to adaptation and to improve farm level cooperation through extended outreach and distribution of institutional services, particularly climate-specific farm advisory services.",,ok,elsevier_api,200,,2026-01-22T20:04:33Z,2026-01-22T20:04:33Z,0,2016,parsed_from_citation,include,,pass,,,yes,We interviewed a total of 450 farming households,True,yes,This article investigates the farm level risk perceptions and different aspects of vulnerability to climate change including sensitivity and adaptive capacity,True,yes,"The country has experienced many severe floods, droughts and storms over the last decades.",True,yes,We interviewed a total of 450 farming households through structured questionnaires,True,yes,in three districts of Punjab province of Pakistan.,True,,,101016jscitotenv201511125,Passed,Unknown,Peer Reviewed,,,,,,,True,True,"Abid, M., Schilling, J., Scheffran, J. et al.",Science of The Total Environment,2016,"Abid, M., Schilling, J., Scheffran, J., & Zulfiqar, F. (2016). Climate change vulnerability, adaptation and risk perceptions at farm level in Punjab, Pakistan. Science of the total environment, 547, 447–460."
