doi,title,year,file_path
10.55214/25768484.v9i2.4406,Model for implementing sustainable agriculture based on good agricultural practice as a strategy for adapting to the impact of climate change,2025.0,/Users/zarrar/projects/ilri-climate-adaptation-effectiveness/scripts/outputs/step13/fulltext/doi_10.55214_25768484.v9i2.4406.pdf
10.5539/jsd.v7n5p68,"Managing climate risks using seasonal climate forecast information in Vhembe district in Limpopo province, South Africa",2014.0,/Users/zarrar/projects/ilri-climate-adaptation-effectiveness/scripts/outputs/step13/fulltext/doi_10.5539_jsd.v7n5p68.pdf
10.56369/tsaes.3789,DROUGHT COPING STRATEGIES BY SMALLHOLDER CATTLE FARMERS IN ZIMBABWE,2022.0,/Users/zarrar/projects/ilri-climate-adaptation-effectiveness/scripts/outputs/step13/fulltext/doi_10.56369_tsaes.3789.pdf
10.5751/es-04216-160302,Coping with multiple stresses in rural South Africa.,,/Users/zarrar/projects/ilri-climate-adaptation-effectiveness/scripts/outputs/step13/fulltext/doi_10.5751_es-04216-160302.pdf
10.5751/es-11489-250131,Tracing environmental and livelihood dynamics in a tropical coastal lagoon through the lens of multiple adaptive cycles,,/Users/zarrar/projects/ilri-climate-adaptation-effectiveness/scripts/outputs/step13/fulltext/doi_10.5751_es-11489-250131.pdf
10.5897/ajar2025.17014,Climate change information access among rural women farmers in Ghana.,,/Users/zarrar/projects/ilri-climate-adaptation-effectiveness/scripts/outputs/step13/fulltext/doi_10.5897_ajar2025.17014.pdf
10.5897/jaerd2017.0905,"Harmonization of extension messages on climate smart agriculture in Malawi: do we speak with one voice, and to whom?",,/Users/zarrar/projects/ilri-climate-adaptation-effectiveness/scripts/outputs/step13/fulltext/doi_10.5897_jaerd2017.0905.pdf
